{
  "component_id": "graph-subsystem",
  "target_module": "mapeogeo.graph",
  "target_files": [
    "src/mapeogeo/graph/decision_graph.py",
    "src/mapeogeo/graph/topology.py"
  ],
  "source_repository": "NB11B/MAPEOGEO",
  "source_branch": "remotes/origin/agent/e32-typed-parallel-decision-graph-spec",
  "source_commit": "74e51bd",
  "source_files": [
    "src/graph/decision_graph.py"
  ],
  "source_qualification_status": "AGENT_SPEC_QUALIFIED",
  "v2_qualification_status": "PENDING_V2_QUALIFICATION",
  "qualification_gate_requirements": [
    "Typed DAG topological sort and cycle-detection invariant tests"
  ],
  "notes": "Typed parallel decision graph"
}